{
    "agent_card_version": "1.0",
    "agent_id": "oci_specialist_v1",
    "agent_name": "OCI Cloud Specialist",
    "agent_type": "specialist",
    "description": "Cloud architect for Oracle Cloud Infrastructure.",
    "version": "1.0.0",
    "trust_domain": "EXECUTION",
    "module_path": "swarms.team_agent.specialists.oci_specialist",
    "class_name": "OCISpecialist",
    "capabilities": [
        {
            "capability_id": "cap_oci_deploy_v1",
            "capability_type": "deployment",
            "name": "OCI Deployment",
            "description": "Deploys resources to OCI.",
            "version": "1.0.0",
            "domains": [
                "cloud",
                "devops"
            ],
            "keywords": [
                "oci",
                "oracle",
                "cloud",
                "deploy"
            ],
            "price_per_invocation": 15.0,
            "input_schema": {
                "type": "object"
            },
            "output_schema": {
                "type": "object"
            }
        }
    ]
}